{
  "$schema": "http://json-schema.org/draft-07/schema#",
  "$id": "https://raw.githubusercontent.com/DistributedCollective/slayer-data/main/schemas/chain.schema.json",
  "title": "Blockchain Network Configuration",
  "description": "Schema defining a blockchain network configuration for RPC connection and metadata.",
  "type": "object",
  "properties": {
    "$schema": {
      "type": "string",
      "format": "uri",
      "const": "https://raw.githubusercontent.com/DistributedCollective/slayer-data/main/schemas/chain.schema.json",
      "description": "Schema version URL."
    },
    "name": {
      "type": "string",
      "description": "Human-readable name of the blockchain network, e.g. 'RSK'."
    },
    "logoURI": {
      "type": "string",
      "format": "uri",
      "description": "Public URL to a chain logo image."
    },
    "chainId": {
      "type": "integer",
      "description": "Unique numeric identifier for the blockchain network."
    },
    "rpcUrls": {
      "type": "array",
      "description": "List of RPC endpoint URLs used to connect to the blockchain.",
      "items": {
        "type": "string",
        "format": "uri"
      },
      "minItems": 1
    },
    "nativeCurrency": {
      "type": "object",
      "description": "Information about the native currency of the blockchain network.",
      "properties": {
        "symbol": {
          "type": "string",
          "description": "Ticker symbol of the native currency, e.g. 'ETH'."
        },
        "decimals": {
          "type": "integer",
          "description": "Number of decimal places used by the native currency.",
          "minimum": 0
        },
        "address": {
          "type": "string",
          "pattern": "^0x[0-9a-fA-F]{40}$",
          "description": "20-byte hex address with 0x prefix (EVM). Provide if native coins has both zero address and ERC-20 address."
        }
      },
      "required": ["symbol", "decimals"],
      "additionalProperties": false
    },
    "blockExplorerUrls": {
      "type": "array",
      "description": "List of URLs pointing to blockchain explorers.",
      "items": {
        "type": "string",
        "format": "uri"
      },
      "minItems": 1
    }
  },
  "required": [
    "name",
    "logoURI",
    "chainId",
    "rpcUrls",
    "nativeCurrency",
    "blockExplorerUrls"
  ],
  "additionalProperties": false
}
